<PoortegoTransformResponse
xmlns:xsi="http://www.w3.org/2001/XMLSchema-instance"
xsi:noNamespaceSchemaLocation="PoortegoTransformResponse.xsd">
 <ResponseData>
  <Entities>
   <Entity title='google.com' type='domain' />
   <Entity title='www.l.google.com' type='domain'>
    <AdditionalField name='source' value='DigTransform' />
   </Entity>
  </Entities>	
  <Links>
   <Link title='CNAME' entity_a='google.com' entity_b='www.l.google.com' />
  </Links>
 </ResponseData>
 <ResponseMessages>
  <Message title='Test' type='Error'>This is a test</Message>
 </ResponseMessages>
</PoortegoTransformResponse>

